Total (1);2.677971483200922;8.096301714790846;5.52497412724838;5.938873489355621;4.135949885118117;4.87618289831904
Sem instrução;7.744146101777296;25.467885464263063;16.955062444884653;20.22520776229557;11.671064201805624;14.730367926653656
Fundamental incompleto ou equivalente;3.35;12.7;7.28;8.83;5.37;6.15
Fundamental completo ou equivalente;6.6;21.82;15.4;16.36;10.46;12.89
Médio incompleto ou equivalente;7.32;26.09;16.15;18.56;11.86;16.21
Médio completo ou equivalente;5.68;19.21;12.63;12.04;9.51;11.68
Superior incompleto ou equivalente;11.98;35.9;30.97;25.65;24.07;22.99
Superior completo ou equivalente;11.05;36.86;25.08;26.15;21.56;20.29
