;Unnamed: 1_level_0;Própria residência ;Via pública;Outro
Total (1);2.182154660674005;3.6322210622736537;2.6082115530103054;3.5719745562192995
Sem instrução;5.94;8.93;8.18;12.19
Fundamental incompleto ou equivalente;2.79;5.26;3.55;4.56
Fundamental completo ou equivalente;4.99;9.12;6.64;9.57
Médio incompleto ou equivalente;5.52;12.13;7.18;10.1
Médio completo ou equivalente;4.0;7.28;5.29;7.93
Superior incompleto ou equivalente;8.61;17.67;12.06;16.83
Superior completo ou equivalente;7.53;15.84;9.93;15.78
