;0.0;7.934803550250025;4.7810171065600535;5.511568432629823;3.105985524221105;3.8905677701786
;0.0;24.198734985850233;16.077324420659078;19.147277508647203;8.201289662329518;12.143504345404468
fundamental incompleto ou equivalente;0;12.61;6.46;8.32;4.22;4.91
fundamental completo ou equivalente;0;20.78;13.4;14.82;8.55;11.29
médio incompleto ou equivalente;0;25.14;15.59;17.71;10.14;12.56
médio completo ou equivalente;0;18.09;11.8;11.02;7.73;9.59
superior incompleto ou equivalente;0;33.44;29.16;22.35;21.12;19.61
superior completo ou equivalente;0;35.41;21.9;24.96;19.02;16.26
